"Title","Accession #","Category","Associated People","Associated Place(s)","Creator(s)","Date","Collection","Held At","Medium","Size","Description","URL","Associated Files","Transcription Files"
"Pierce family correspondence","1978-39-8","Collections of Papers","John Pierce; Sarah Pierce; James Pierce; Harriet Beecher Stowe; Jedediah Strong; Oliver Wolcott (1726-1797); ",,"James Pierce; John Pierce","1775-1825","Pierce family correspondence","Litchfield Historical Society",,".42 linear feet","The Pierce Family Correspondence consists primarily of letters to and from the children of John Pierce and his first wife, Mary (Paterson) Pierce, as well as of his second wife, Mary (Goodman) Pierce. The collection documents events of national importance: John Pierce, a colonel and paymaster in the Continental Army, received letters from numerous correspondents concerning military, administrative, and political news of the American Revolution. Moreover, the Pierce brothers traveled extensively along the East Coast as well as in the South, and their letters provide a record of the industrial and social development, natural resources, and scenery of the major cities of the early American republic as well as contemporary opinions on the condition of slavery in America.

Since Timothy Pierce was a doctor, many of his letters illuminate medical practice during this time, including the difficulties of setting up a private practice and the realities of military medicine. Meanwhile, the letters to Sarah Pierce make references to her role as founder and teacher of the Litchfield Female Academy, a nationally prominent girls' school. The collection includes a letter to Pierce from Harriet Beecher Stowe praising her history textbook and requesting copies of it, correspondence about boarders for the school, and three silk diplomas.

Finally, the letters also shed light on social life in the early republic, as the Pierce brothers frequently attended parties, went on steamboat trips, advised their sisters on deportment, and discussed women's fashions with them.","http://www.litchfieldhistoricalsociety.org/archon/index.php?p=collections/controlcard&id=3",,
"Harriet Beecher Stowe letter","1978-39-8","Collections of Papers","Harriet Beecher Stowe; Sarah Pierce",,"Harriet Beecher Stowe",,"Pierce family correspondence","Litchfield Historical Society",,"1 item","Letter to Sarah Pierce. Praises her ""History"" as an excellent textbook for children and requests copies of it to use to teach her own children.","http://www.litchfieldhistoricalsociety.org/archon/index.php?p=collections/controlcard&id=3",,
"Lucy Sheldon Beach letter","2009-56-0","Correspondence","Lucy Sheldon Beach; Huldah Sheldon",,"Lucy Sheldon Beach","1810 Nov 29","Small acquisitions","Litchfield Historical Society",,"1 Item","Lucy Sheldon in New York writes to her mother Huldah Sheldon (Mrs. Daniel) in Litchfield about her trip by coach to New Haven and then by packet boat to New York. She gives her impressions of life in the city.","http://www.litchfieldhistoricalsociety.org/archon/?p=collections/controlcard&id=136",,
"Samuel Shepard letter","2009-53-0","Correspondence","Samuel Shepard",,"Samuel Shepard","1793 Mar 4","Small acquisitions","Litchfield Historical Society",,"1 Item","A letter to Misses Martha Ellsworth, Polly Ellsworth and Nancy Strong in Chatham. Dated Yale College, March 4th 1793. Mr. Shepard writes about missing friends, the noise of the town, his health, and that he has little time to write letters.","http://www.litchfieldhistoricalsociety.org/archon/?p=collections/controlcard&id=103",,
"John Cotton Smith letters","1948-08-0","Correspondence","Tapping Reeve; Elizabeth Reeve; Lyman Beecher",,"John Cotton Smith","1823-1824","Small acquisitions","Litchfield Historical Society",,"1 Item","Drafts of letters by John Cotton Smith of Sharon (Conn.) including a tombstone inscription for Tapping Reeve; one page letter to Rev. Henry A. Rowland about school in New York for John Cotton Smith's son; two page letter to Mrs. Tapping Reeve about publication of Book of Descents, tombstone inscription for Tapping Reeve, and visit of Mrs. Reeve and Rev. Beecher. All 3 items are on one large, folded piece of paper.",,,
"Congregational Church seating plan","1997-34-0","Buildings","Judah Champion; ",,"unknown author","circa 1788","Stoddard Family Papers","Litchfield Historical Society",,"1 Item","Seating plan for the First Congregational Church showing details of which person sat in each pew.","http://www.litchfieldhistoricalsociety.org/archon/?p=collections/controlcard&id=310","scan",
"Harriet Beecher Stowe letter","1937-09-0","Correspondence","Harriet Beecher Stowe; Maria Tallmadge Cushman",,"Harriet Beecher Stowe","1829 Jun 27","Small acquisitions","Litchfield Historical Society",,"1 Item","Harriet Beecher in Saratoga, NY wrote to Maria Tallmadge Cushman in Troy, NY noting that she visited Saratoga to restore her health but desired to travel to Litchfield.  She requested information about the best route or any acquaintances who might be traveling there.","http://www.litchfieldhistoricalsociety.org/archon/?p=collections/controlcard&id=65",,
"Jedediah Strong Collection","2010-122-0","Collections of Papers","Jedediah Strong; James Morris; ",,"Jedediah Strong","1798-1799","Small acquisitions","Litchfield Historical Society",,"1 folder","A letter from Heber Stone and James Morris, Select Men in Litchfield to the Court of Common Pleas, informing the Court that they have appointed Samuel Seymour to oversee the affairs of Jedediah Strong. Dated 1798 Dec. 1. Also a petition from Jedediah Strong dated Dept. 1799 to change his guardian to Nehemiah Strong; includes ramblings against his abuse by the community after years of distinguished service.","http://www.litchfieldhistoricalsociety.org/archon/?p=collections/controlcard&id=467",,"2010-122-0/Jedediah Strong Memorial 1799; 2010-122-0b/Apponitment of Overseer; 2010-122-0c/Estate Inventory; 2010-122-0d/Testimony re: Ephraim Kirby; 2010-122-0e Jedediah Strong Memorial 1794; 2010-122-0f/Jedediah Strong Memorial 1795"
"Susan Tracy letter","2009-59-0","Correspondence","Susannah Bull Tracy; George Gould",,"Susan Bull Tracy","1826 Aug 23","Small acquisitions","Litchfield Historical Society",,"1 Item","Letter from Susannah Bull Tracy in Litchfield to her grandson George Gould in New Haven asking that he find some ribbon to match an enclosed sample. Some family news also.","http://www.litchfieldhistoricalsociety.org/archon/?p=collections/controlcard&id=133",,
"Uriah Tracy collection","2010-50-0","Correspondence","Uriah Tracy",,"Uriah Tracy","1786-1808","Small acquisitions","Litchfield Historical Society",,"4 items","Three letters from Uriah Tracy and a description of a monument erected to his memory in Washington, D.C. in 1808.","http://www.litchfieldhistoricalsociety.org/archon/?p=collections/controlcard&id=239",,
"Uriah Tracy letter","1914-29-0","Correspondence","Uriah Tracy",,"Uriah Tracy","1800 May 24","Small acquisitions","Litchfield Historical Society",,"1 Item","Uriah Tracy in Litchfield (Conn.) writes to James McEvers, a merchant in New York, that he plans to settle all his debts by selling his real estate. Mr. Tracy asks for Mr. McEvers' patience and assures him that he will be paid.","http://www.litchfieldhistoricalsociety.org/archon/?p=collections/controlcard&id=110",,
"Jonathan Trumbull letter","2009-156-0","Correspondence","Andrew Adams",,"Jonathan Trumbull","1769 Apr 15","Small acquisitions","Litchfield Historical Society",,"1 Item","A letter from Jonathan Trumbull dated from Lebanon (Conn.) 15 April 1769 to Andrew Adams, attorney at law, Litchfield, Conn. stating that Col. Livingston has commenced an action in Litchfield Court against Mr. Joel Hervey of Sharon (Conn.) and himself. He requests that Mr. Adams represent him in the case.","http://www.litchfieldhistoricalsociety.org/archon/?p=collections/controlcard&id=177",,
"Woodruff family collection","1953-02-2","Collections of Papers","George Catlin Woodruff; Lucy Seymour Woodruff; Henrietta Seymour Woodruff; Lewis Bartholomew Woodruff; Morris Woodruff",,"George Catlin Woodruff","1779-1966","Woodruff family collection","Litchfield Historical Society",,"9 linear feet","The Woodruff Collection primarily documents the personal life and professional career of George Catlin Woodruff, who not only practiced law for several decades in Litchfield but also served as Litchfield's postmaster and held elected positions both locally and in the United States Congress.

His law career is extensively represented in his business correspondence with clients concerning suits in progress and with other law professionals; his law school notebooks; and his own notes on pending lawsuits. These papers document the education and routine work of a lawyer in this period, as well as the networks among lawyers in New England and their relationships with judges, courts, and other members of the judicial system.

The collection also illuminates the central position of the postal service in the early republic through letters sent to Woodruff in his capacity as postmaster of Litchfield. These include not only correspondence with other postmasters concerning mail schedules and misdirected letters, but also correspondence from individuals from other towns seeking information about Litchfield inhabitants, reporting suspicious activities, and asking for assistance in publicizing their own careers.

Additionally, Woodruff's extensive personal correspondence with his family sheds light on his personal life, especially in letters to and from his brothers Lewis B. Woodruff, a lawyer in New York, and Reuben M. Woodruff, a physician. These letters record their efforts to establish and develop their careers, their travels along the east coast and the southern United States, and family and social news. Moreover, the collection includes Woodruff's personal papers, which trace his interest in genealogical research, the history of Litchfield, and his autobiographical efforts.

The collection follows Woodruff's political career through newspaper clippings and his own handwritten records of local and national election results, as well as documents his other business ventures, including investments in railroads, canals, and banks, and his involvement in the Litchfield Mutual Fire Insurance Company. By extension, these papers reveal political processes and economic developments during this time period.

Also present in this collection are the papers of numerous Woodruff relatives, as well as those of other prominent and lesser-known Litchfield families. For example, the collection documents the extensive land transactions executed by Woodruff's father, Morris Woodruff, especially in partnership with Simeon Harrison; the law career of his son George M. Woodruff; and his grandson James P. Woodruff's law and political careers. The collection also includes many personal and business papers from members of the Seymour and Wolcott families, as well as from the family of Henry E. Gates, who served as a physician during the Civil War, and from Grant Wickwire, a prosperous Litchfield farmer.","http://www.litchfieldhistoricalsociety.org/archon/?p=collections/controlcard&id=4",,
"George C. Woodruff law notebooks","1953-02-2","Notebook","George Catlin Woodruff",,"George Catlin Woodruff",1825,"Woodruff family collection","Litchfield Historical Society",,"4 volumes","Five notebooks, labeled ""Gould's Lectures"" on spine, consisting of George C. Woodruff's notes taken during law school lectures.  ","http://www.litchfieldhistoricalsociety.org/archon/?p=collections/findingaid&id=4&q=&rootcontentid=1371#id1371","LegalTree1lr.jpg; LegalTree2lr.jpg",
"Litchfield Law School Collection","1890-10-0","Collections of Papers","Tapping Reeve; James Gould",,"Tapping Reeve; James Gould","1773-1990","Litchfield Law School Collection","Litchfield Historical Society",,"4 boxes and 50 volumes","In 1773, the newly married Tapping Reeve and Sally Burr Reeve settled in Litchfield where Reeve promptly established a legal practice. The following year, Sally's brother Aaron Burr came to live with them and Reeve began to instruct him in the law. Several prominent residents of Litchfield also sent their sons to Reeve for legal training, establishing his reputation as a teacher and forming the nucleus of what was to become America's first formal school of law.

As the number of students increased, Reeve began to develop a series of formal lectures that prepared
. . . [read more]

students to take the bar exam and practice law. In the years following the Revolution most lawyers taught through the apprenticeship system because there were no schools that offered law degrees. Reeve’s decision to pass on his legal knowledge through formal organized classes distinguished him from others who were training new lawyers. By 1784 the number of students enrolling outgrew the space in Reeve's parlor office, prompting Reeve to construct a one-room school building next to his house.

Through his lectures, Tapping Reeve sought to train his students in legal principles and their application to any legal situation. Reeve and his eventual partner James Gould, developed a detailed eighteen month course of lectures, covering every aspect of legal practice. Students took copious lecture notes that they then carefully re-copied and had bound into leather volumes. These volumes provided the Litchfield Law School graduates with the basis of their office law libraries. The students then used their bound notes as reference manuals for the rest of their careers.

Alumni of the Litchfield Law School had a tremendous impact on the development of the new nation, shaping the creation of the American legal and judicial systems, and profoundly influencing subsequent developments in legal education. Reeve's emphasis on a system of legal principles rather than local laws and statutes, his use of legal cases in teaching, his establishment of student moot courts, and his division of lectures into subjects, all shaped legal education as we know it today.

The Law School attracted over 1,200 students from 13 states and territories to study in Litchfield. Graduates formed a network of leadership and influence that encompassed public service, business, and other areas of American life. Ultimately, the small law school would educate two US vice-presidents (Aaron Burr and John C. Calhoun), as well as 14 governors, 14 members of the federal cabinet, 28 U.S. Senators, 100 members of the House of Representatives, three Justices of the U.S. Supreme Court, and many other state and local public officials.

This collection includes materials pertaining to Tapping Reeve, James Gould, the Litchfield Law School, and alumni of the school.  It was assembled by the Historical Society over a period of years.  The student images were originally collected for display on the walls of the Tapping Reeve House.  When the house was reinterpreted in 1998, the photos were relocated to the Litchfield Law School Collection.

Many of the published law books used by Reeve and his students are also held by the Society and can be found through the book catalog.  The Society's institutional records document the history of the Tapping Reeve House and Litchfield Law School building.  There is no known comprehensive collection of Tapping Reeve's personal or business papers though collections such as this contain examples of his correspondence and legal work.","http://www.litchfieldhistoricalsociety.org/archon/index.php?p=collections/findingaid&id=10&q=",,
"Asa Bacon law notebooks","1890-10-0","Notebook","Asa Bacon",,"Asa Bacon; Tapping Reeve",1794,"Litchfield Law School Collection","Litchfield Historical Society",,"5 volumes","Asa Bacon (1771-1857) attended the Litchfield Law School in 1794. His notebooks consist of 5 volumes of law notes from classes of Tapping Reeve taken at the Litchfield Law School in 1794. Subjects include Municipal Law, Husband and Wife, Parent and Child, Contracts, Mortgages, Pleas and Pleadings, and Comparison of English and Connecticut Law.","http://www.litchfieldhistoricalsociety.org/archon/index.php?p=collections/findingaid&id=10&q=&rootcontentid=3068#id3068",,
"Ebenezer Baldwin law notebooks","1890-10-0","Notebook","Ebenezer Baldwin",,"Ebenezer Baldwin; Tapping Reeve; James Gould",1810,"Litchfield Law School Collection","Litchfield Historical Society",,"5 volumes","Ebenezer Baldwin (1790-1837) attended the Litchfield Law School in 1810.  His notebooks consist of 5 volumes of law lecture notes from classes taught by Tapping Reeve and James Gould at the Litchfield Law School. Some of the topics in the volumes (numbers assigned by Litchfield Historical Society staff) are: Vol. 1 - Pleas and Pleadings,; vol. 2 - Real Property, public wrong, ;vol. 3 - Municipal law, Husband & Wife; vol.4 - Actions; vol. 5 - Bailment,Contracts, Executives and Administrators.","http://www.litchfieldhistoricalsociety.org/archon/index.php?p=collections/findingaid&id=10&q=&rootcontentid=3068#id3068",,
"Anson Bates law notebook","1890-10-0","Notebook","Anson Bates",,"Anson Bates; Tapping Reeve; James Gould",1820,"Litchfield Law School Collection","Litchfield Historical Society",,"1 volume","Anson Bates (1799-1869) attended the Litchfield Law School in 1820.  His lecture notes from classes taught by Tapping Reeve and James Gould at the Litchfield Law School, consist of 1 volume with the title"" Contracts"".","http://www.litchfieldhistoricalsociety.org/archon/index.php?p=collections/findingaid&id=10&q=&rootcontentid=3068#id3068",,
"Cornelius Dubois law notebooks","1890-10-0","Notebook","Cornelius Dubois",,"Cornelius Dubois; James Gould",1830,"Litchfield Law School Collection","Litchfield Historical Society",,"2 volumes","Cornelius Dubois (1810-1881) was a student at the Litchfield Law School in 1830. His 2 volumes of lectures notes taken from classes taught by James Gould are labelled ""Volume 4"" and ""Volume 6"". Volume 4 includes Action ex Delicato, 601 pages; and volume 6 includes Law Merchant, Partnerships, and Insurance.","http://www.litchfieldhistoricalsociety.org/archon/index.php?p=collections/findingaid&id=10&q=&rootcontentid=3068#id3068",,
"Robert Fairchild law notebook","1890-10-0","Notebook","Robert Fairchild",,"Robert Fairchild; Tapping Reeve",1794,"Litchfield Law School Collection","Litchfield Historical Society",,"1 volume","Robert Fairchild (1775-1835) was a student at the Litchfield Law School in 1794. His notebook of lecture notes taken from classes taught by Tapping Reeve consists of 550 pages. Written on the first page is ""continuation of a lecture on contracts"" indicating that there was a prior notebook. Other topics include Real Property, On Evidence; and, Estates of Deceased Persons.","http://www.litchfieldhistoricalsociety.org/archon/index.php?p=collections/findingaid&id=10&q=&rootcontentid=3068#id3068",,
"Hiram Gould Goodwin law notebook","1890-10-0","Notebook","Hiram Gould Goodwin",,"Hiram Gould Goodwin; William G. Williams; Tapping Reeve",1829,"Litchfield Law School Collection","Litchfield Historical Society",,"1 volume","Hiram Gould Goodwin (1808-1885) was a student at the Litchfield Law School in 1829. On the first page of his notebook of lecture notes is written ""Reeves Lectures, taken from Wm. G. Williams by Hiram Goodwin, 1828. LEX."" William Gilbert Williams was a Litchfield Law School student in 1799. There are also moot court case notes inside the front cover.","http://www.litchfieldhistoricalsociety.org/archon/index.php?p=collections/findingaid&id=10&q=&rootcontentid=3068#id3068",,
"George Gould law notebooks","1890-10-0","Notebook","George Gould",,"George Gould; James Gould",1827,"Litchfield Law School Collection","Litchfield Historical Society",,"2 volumes","George Gould, son of Judge James Gould and Sally (Tracy) Gould was born in Litchfield, Conn. in 1807 and died in Troy, NY in 1868.  He attended the Litchfield Law School in 1827 and in 1830-1831 he aided his father by reading his lectures to the students. His notebooks consist of 2 volumes of lecture notes from classes taught by his father, James Gould. The main topics in the volumes are: Vol. 1 - Criminal Law; and Vol. 2 - Contracts.","http://www.litchfieldhistoricalsociety.org/archon/index.php?p=collections/findingaid&id=10&q=&rootcontentid=3068#id3068",,
"Josiah Houton law notebook","1890-10-0","Notebook","Josiah Houghton",,"Josiah Houghton; Tapping Reeve; James Gould",1817,"Litchfield Law School Collection","Litchfield Historical Society",,"1 volume","Josiah Houghton (1791?-1833) attended the Litchfield Law School in 1817. His notebook consists of 1 volume of lecture notes. On the title page is written ""A Digest of law in a series of lectures delivered at Litchfield, Conn. by the Hon. Tapping Reeve & James Gould, Esq. and taken stenographically by Josiah Houghton"". Title on the binding ""A Digest of Law - J. Houghton vol. I""  Some of the topics include: Partnership, Sheriffs and Goalers, Statute of Limitations, Inns & Inn Keepers, Evidence.  In the front is a list of students Oct. 1817-Oct. 1818.","http://www.litchfieldhistoricalsociety.org/archon/index.php?p=collections/findingaid&id=10&q=&rootcontentid=3068#id3068",,
"Samuel Andrew Law law notebook","1890-10-0","Notebook","Samuel Andrew Law",,"Samuel Andrew Law; Tapping Reeve",1794,"Litchfield Law School Collection","Litchfield Historical Society",,"1 volume","Lecture notes taken  by Samuel Andrew Law on subjects including slander, heresy and libel.  Unlike many other volumes, these appear to be notes taken during the lecture rather than those later copied and bound for reference.","http://www.litchfieldhistoricalsociety.org/archon/index.php?p=collections/findingaid&id=10&q=&rootcontentid=3068#id3068",,
"Charles Greely Loring law notebooks","1890-10-0","Notebook","Charles Greely Loring",,"Charles Greely Loring; Tapping Reeve; James Gould","1813-1814","Litchfield Law School Collection","Litchfield Historical Society",,"3 volumes","Charles Loring Greely (1794-1867) was a student at the Litchfield Law School in 1813-1814. His 3 volumes of law lecture notes (numbered by the Litchfield Historical Society staff) are titled on the bindings as ""Reeve's and Gould's Lectures"". The title page of Vol. 1 reads ""Lectures on Municipal Law and Private Relations by the Hon. Judge Reeve and James Gould Esq. delivered at their Law Institution Litchfield, Conn. A.D. 1813-1814"". Vol. 1 includes Municipal Law, Parent and Child, Baron and Feme, Executors and Administrators; Vol. 2 includes Lex Mercatoria, Contracts, Actions, Bailments; and Vol. 3 includes Real Property. Only Vol. 3 has a binding label remaining - Reeves & Goulds Lectures/Real Property.","http://www.litchfieldhistoricalsociety.org/archon/index.php?p=collections/findingaid&id=10&q=&rootcontentid=3068#id3068",,
"Nathaniel Mather law notebooks","1890-10-0","Notebook","Nathaniel Mather",,"Nathaniel Mather; Tapping Reeve; James Gould","1811-1813","Litchfield Law School Collection","Litchfield Historical Society",,"6 volumes","Nathaniel Mather (1788-1837) was a student at the Litchfield Law School in 1811-1813. His notebooks consist of 6 volumes of law lecture notes  from classes of Tapping Reeve and James Gould from 1811-1813. Topics in Volume 1 include Municipal Law, Baron and Feme, Parent and Child; Volume 2 - Sheriffs and Jailors, Executors and Administrators, Contracts;  Volume 3 - Bailment, Contracts; Private Wrongs; Volume 4 - Pleas and Pleadings; Evidence, Powers of Chancery; Volume 5 - Real Property, Mortgages, Trespass; Volume 6 - Criminal Law, Mercantile Law, practice of Connecticut; and an appendix of questions discussed in Moot Hall.","http://www.litchfieldhistoricalsociety.org/archon/index.php?p=collections/findingaid&id=10&q=&rootcontentid=3068#id3068",,
"Alexis Painter law notebook","1890-10-0","Notebook","Alexis Painter",,"Alexis Painter; Tapping Reeve; James Gould",1817,"Litchfield Law School Collection","Litchfield Historical Society",,"1 volume","Alexis Painter (1794-1867) was a student at the Litchfield Law School  in 1817. His one volume of law lecture notes from classes of Tapping Reeve and James Gould includes various topics including Contracts, Bailments, Covenant Broken, and Evidence, and includes an index.","http://www.litchfieldhistoricalsociety.org/archon/index.php?p=collections/findingaid&id=10&q=&rootcontentid=3068#id3068",,
"Origen Storrs Seymour law notebooks","1890-10-0","Notebook","Origen Storrs Seymour",,"Origen Storrs Seymour; James Gould",1824,"Litchfield Law School Collection","Litchfield Historical Society",,"6 volumes","    Origen Storrs Seymour (1804-1881) was a student at the Litchfield Law School in 1824. His notebooks consist of 6 volumes of lecture notes from classes taught by James Gould.  On the binding of his 6 volumes of law lecture notes: ""Gould's Lectures"" and ""O.S. Seymour"".

    Some subjects included are: Vol. 1 - Municipal Law, Husband and Wife, Parent and Child; Vol. 2 - Actions, Pregotive Rights,Real Property; Vol. 3 - Real Property, Trepass; Farudulent Conveyance; Powers of Chancery; Vol. 5 - Pleadings, New Trilas, Evidence; Vol. 6 - Sheriffs and Jailors, Bailments, Bills of Exchange, Master and servant.

    Origen S.Seymour also served at an assistant to Judge Gould in the Law School.","http://www.litchfieldhistoricalsociety.org/archon/index.php?p=collections/findingaid&id=10&q=&rootcontentid=3068#id3068",,
